592356_raw_html.txt,Chicago's subways are getting speedy LTE data,forgot username/password? remember me
1395822_raw_html.txt,Raising boys? Help yourself to some gender stereotypes -  The F-Word,"Steve Biddulph's bestseller on bringing up boys takes us on a trip back to 19th century, says Clare Gould"
3438912_raw_html.txt,Quantum Algorithm Zoo,"This is a comprehensive catalog of quantum algorithms. If you notice any errors or omissions, please email me at . Your help is appreciated and will be acknowledged ."
3369414_raw_html.txt,Startup toasts Snake Bite in a bottle - San Francisco Business Times,2015 American City Business Journals. All rights reserved. Use of this Site constitutes acceptance of our User Agreement (updated 12/23/13) and Privacy Policy (updated 12/23/13).
4034976_raw_html.txt,Danny Brown Interview: Sky High (2013 Cover Story) | Complex,DANNY BROWN / SKY HIGH 0%
427158_raw_html.txt,No DNA Match on DB Cooper Suspect  | NBC Southern California,DNAfrom the necktie of legendary hijacker D.B. Cooper did not match that of the FBI's latest suspect in the mysterious 1971 case.
2462424_raw_html.txt,Life With Beagle: Living with a diabetic dog: Meet KC the cairn terrier,Feel free to leave me feedbark!
2239386_raw_html.txt,Blackphone bringing out privacy-focused app store - Play | siliconrepublic.com - Ireland's Technology News Service,Apple Pay goes live in the UK HSBC misses launch
1870518_raw_html.txt,crown | choker | bad ass | Clutch Jewelry,Customer Login (928) 351-7021 stacy@clutchjewelry.com
3093102_raw_html.txt,Barcode Scanner SDK | Mobile App Suite for Retail | Scandit,"We provide the highest quality in mobile barcode scanning solutions for smartphones, tablets and wearable devices."
2863602_raw_html.txt,"2006 Dublin riots - Wikipedia, the free encyclopedia","The 2006 Dublin riots were a series of riots which occurred in Dublin on 25 February 2006, precipitated by a proposed controversial march down O'Connell Street of a unionist demonstration. The disturbances began when members of the Garda Sochna attempted to disperse a group of counter-demonstrators who were blocking the route of the proposed march on O'Connell Street . Some local youths joined forces with the counter-demonstrators, and the situation escalated."
2604438_raw_html.txt,Sexy Teacher,My husband and I are going to Greece and Italy this summer in June. We are looking for couples to have fun with. Anyone in those areas?
305868_raw_html.txt,Stars shine on the Critics' Choice Awards red carpet,Settings
2969052_raw_html.txt,Pancake Letterpress Co. teams up with AgapeProject25.com  The Pancake Letterpress Co.,Your Custom Text Here
2289666_raw_html.txt,"14 Questions Your Parents Have About Your Job In ""Media""","Sounds complicated! Its a bummer they dont know what you do, but its awesome that they dont know their birthday presents are always re-gifted sponsored swag."
866904_raw_html.txt,Double-Stacked Cinnamon Roll Cake How-To from Pillsbury.com,Join FREE | Login
151338_raw_html.txt,Hosting a Baby Shower - Cute Baby Shower Ideas,Type to Search
1543092_raw_html.txt,"15 Products that save Time, Money, and Space - Lazy Man and Money","The holidays are quickly approaching and that means shopping season is in high gear. Good luck going to a mall. It's too crowded for my taste. I'll be getting almost all of my gifts on Amazon and Ebay. For the rest, I'll pick up gift cards from the local drugstore. I know some people hate gift cards, but I got the feeling that my mom is going to love her Netflix subscription - especially as this writer's strike continues."
1824294_raw_html.txt,Im Land der langen Schatten  Wikipedia,"Im Land der langen Schatten ist ein Spielfilm von Nicholas Ray aus dem Jahr 1960. Der Film stellt aus der Sicht der Eskimos die unterschiedlichen Lebenswelten und die kulturellen Unterschiede heraus, die Missverstndnisse und Konflikte auslsen. Dies relativiert die scheinbare berlegenheit und Gerechtigkeit des weien Mannes. Er entstand nach dem Roman Top of the World von Hans Ruesch , der auch am Drehbuch beteiligt war. Am 29. September 1960 erfolgte die deutschsprachige Erstauffhrung."
3982170_raw_html.txt,summer cocktail favorites | RedEnvelope Blog,"There is something about summer that makes it perfectly acceptable to have a mid-day cocktail. Perhaps it is because the days are longer, or maybe it's the sultry heat that begs for a response stronger than ice water. From frozen blender drinks to big batch cocktails meant to be shared, these 33 summer recipes feature seasonal ingredients like fresh berries, stone fruit, citrus and herbs."
272244_raw_html.txt,"Limo service News: If You Are Looking For A Superb Limo Service In Chicago, Illinois, Then You Should Definitely Consider W-Limo",US India Canada More
1331034_raw_html.txt,Euro Truck Simulator 2 developers experimenting with Oculus Rift support | Polygon,"By Alexa Ray Corriea on May 09, 2013 at 10:00a"
2066766_raw_html.txt,"OVA FOTKA ZAPALILA JE INTERNET, ZNATE LI ZATO? Ne morate biti perverzni da bi to uoili - Jutarnji.hr",SPOLNI OBLIK
845844_raw_html.txt,Greek Government Appoints New Finance Minister in Cabinet Shuffle  - WSJ,ATHENSGreece's coalition government announced a cabinet shuffle in a bid to boost its popularity after losing ground in last month's European Parliament elections.
3988734_raw_html.txt,World War Z sorpassa Luomo dAcciaio e tutta la classifica dei film pi visti nello scorso week end 28  30 giugno | oubliettemagazine,"Posted by Oubliette Magazine close Author: Oubliette Magazine Name : A.M. Email: oubliettemagazine@hotmail.it Site: http://oubliettemagazine.com/ About: See Authors Posts (4440) in CINEMA , Classifica | 0 comments"
2478198_raw_html.txt,weird and bizarre Goodwill finds | Picture | Break.com,"Warning, CUTE OVERLOAD! Break has all the funny, stupid, adorable animals ..."
1781832_raw_html.txt,"wax, boogers, and phlegm",posted by Douglas Hoffman @ 8:10 PM 65 comments
3433608_raw_html.txt,Video: Case Study: Marcelo Garcia's Back Body Lock and Crab Ride | MMA Everything,"What's up my Lockflow family? It's been a while. I've been hard at work on a lot of exciting projects and haven't gotten to do much more than lurk 'round these parts. I have been doing a lot of content on Marcelo Garcia's new book (which I wrote), and given how much you guys liked my thesis on his guillotine a year or so ago, I thought you would like an analysis of his crab ride. I tried to paste the content here, but there's multiple videos in the article and it came out all wonky."
1181556_raw_html.txt,The Next Slum? - The Atlantic,Get 10 issues a year and save 65% off the cover price.
73266_raw_html.txt,Poketo Pops-up at Nordstrom | ALU MiND,Filter by
2510958_raw_html.txt,Amlie Art Print by Andreea Benu | Society6,"To add items to your wishlist, simply click the ""Add to Wishlist"" link from any product page."
239724_raw_html.txt,Hot Bbw and chubby girls,(via poompoomchubbygirls )
262116_raw_html.txt,"Old Jewish Comedians - funny, nostalgic portraits of Borscht Belt superstars in their twilight years - Boing Boing","By Mark Frauenfelder at 8:20 am Wed, Feb 4, 2015"
3692538_raw_html.txt,Literature and Film - Resources - Resources - The Galilean Library,Jump to content
3998466_raw_html.txt,"Aurochs - Wikipedia, the free encyclopedia","(Bojanus, 1827) B. p. namadicus ( Falconer , 1859) B. p. africanus ( Thomas , 1881)"
1902864_raw_html.txt,Adult Swim Video,"By using this site, you agree to the Terms of Use and Privacy Policy ."
911382_raw_html.txt,Photos of downtown Las Vegas | Escape of the Week | d travels 'round,Downtown Las Vegas has always held a special place in my heart.
562092_raw_html.txt,La UE pide explicaciones a Espaa por el caso de bola y convoca una reunin,eldiario.es utiliza cookies para que tengas la mejor experiencia de navegacin. Si sigues navegando entendemos que aceptas nuestra poltica de cookies .
1017618_raw_html.txt,Global Sustainability Education Resources  | Facing the Future,"Visit our online store to learn about our hands-on, interdisciplinary curriculum for language arts , math , science , and social studies . Download a free sample lesson from our teacher's guides or a reading from our student texts to see how our resources will engage your students."
2333988_raw_html.txt,"Could This Be The Fastest, Cheapest Food Storage Setup Ever? | Self-Sufficiency",(Before It's News)
2041476_raw_html.txt,Yammie's Noshery: Deep Dish Peanut Butter Pie with Chocolate Covered Pretzel Crust,Some Favorites...
1970952_raw_html.txt,Subway Knitter,Ta-daaaaah!
1471794_raw_html.txt,Game of Boobs,"Game of Thrones Season 2 ended in the USA a few days ago. Americans (and some South Africans) will sadly have to wait another 6 months before Season 3 kicks off. Its definitely one of my favorite TV shows of all time. The storyline is brilliant, it has an excellent cast and the visual effects, gore and wardrobe is just bloody awesome. Many of the guys (and some girls) reading this post are probably also watching this show because it has a lot of boobs in it. Yes folks, I said. I repeat: Many of your reading this are watching Game of Thrones because it has boobs in it. Dont deny it, somewhere inside you theres a boob watcher hiding"
3323880_raw_html.txt,Wordless Wednesday - City of Creative Dreams,The Author
3245454_raw_html.txt,Drawing Ia,DonnaYoung.org What's New Members Subscribe to YoungMinds
3978804_raw_html.txt,"I, Claudius Set For the Big Screen  Slice of SciFi","September 6, 2007 By Sam Sloan Leave a Comment"
